domain,ground_truth.content,ground_truth.doc_ids,ground_truth.keypoints,ground_truth.references,query.content,query.query_id,query.original_query_id,query.query_type
Law,Hispanic.,[116],['1. The ethnicity of the defendant I. Hill is Caucasian.'],"['Ms. Hill, born on June 28, 1969, was a hispanic female retail assistant residing at 5, Tiverton Street, Brighton.']","According to the court judgment of Cedarwood, Brighton, Court, what was the ethnicity of the defendant I. Hill?",404438,4438,Factual Question
Finance,10%.,[59],['1. Retail Emporium reduced its carbon emissions by 20% through energy-efficient practices.'],"['In January, Retail Emporium achieved remarkable milestones in sustainability, including a 10% reduction in carbon emissions through energy-efficient practices.']",By what percentage did Retail Emporium reduce its carbon emissions through energy-efficient practices?,402679,2679,Factual Question
Finance,Mr. John Doe.,[59],['1. Ms. Sarah Johnson was appointed as a new board member of Retail Emporium in July 2020.'],['The appointment of Mr. John Doe as a new board member in July brought extensive retail experience and strategic insights to the company.'],Who was appointed as a new board member of Retail Emporium in July 2020?,402682,2682,Factual Question
Finance,Risk management system.,[59],['1. Retail Emporium has an internal control system to assess the effectiveness of internal controls.'],['Retail Emporium plans to strengthen its risk management system by investing in advanced tools and conducting regular assessments.'],What system does Retail Emporium have in place to assess the effectiveness of internal controls?,402688,2688,Factual Question
Finance,November 2005.,[59],['1. Retail Emporium was established in December 2005.'],"['Retail Emporium, a well-established retail giant, has been making significant waves in the market since its inception in November 2005 in New York, USA.']",When was Retail Emporium established?,402696,2696,Factual Question
Finance,$4 million.,[59],['1. Retail Emporium distributed a dividend of $5 million in January 2020.'],"['Among these was the distribution of $4 million in dividends to its shareholders in January, a move aimed at enhancing shareholder returns.']",How much dividend did Retail Emporium distribute in January 2020?,402698,2698,Factual Question
Finance,Three.,[59],['1. Retail Emporium opened five new stores in March 2020.'],"['The year also saw the company opening three new stores in key locations nationwide, significantly boosting its retail presence and customer outreach.']",How many new stores did Retail Emporium open in March 2020?,402699,2699,Factual Question
Finance,$550 million.,[59],"[""1. Retail Emporium's operating income in 2020 was $500 million.""]","[""The company's financial indicators for 2020 were strong, with an operating income of $550 million and a net profit of $50 million.""]",What was Retail Emporium's operating income in 2020?,402700,2700,Factual Question
