domain,ground_truth.content,ground_truth.doc_ids,ground_truth.keypoints,ground_truth.references,query.content,query.query_id,query.original_query_id,query.query_type
Finance,Local environmental associations.,[65],['1. Green Fields Agriculture Co. partnered with local NGOs in September 2018.'],"[""May's Fair Trade Certification acquisition highlighted ethical practices, while June's water conservation and September's partnerships with local environmental associations reflected a commitment to sustainability.""]",With whom did Green Fields Agriculture Co. partner in September 2018?,402160,2160,Factual Question
Finance,"March 18, 1996.",[65],"['1. Green Fields Agriculture Co. was established on March 18, 1995.']","['Established on March 18, 1996, this publicly listed company in Ruralville, Agriprovince, focuses on the production and distribution of organic produce.']",When was Green Fields Agriculture Co. established?,402171,2171,Factual Question
Finance,25%.,[65],['1. Sales volume increased by 20% in January 2018 due to a new sales strategy.'],"['This was bolstered by a 25% increase in sales volume in January 2018, following a new sales strategy.']",By what percentage did sales volume increase in January 2018 due to a new sales strategy?,402172,2172,Factual Question
Finance,150 acres.,[65],['1. Green Fields Agriculture Co. acquired 100 acres of farmland in March 2018.'],"['Subsequently, in March, the company acquired 150 acres of farmland, aiming to reduce reliance on third-party suppliers.']",How many acres of farmland did Green Fields Agriculture Co. acquire in March 2018?,402173,2173,Factual Question
Finance,10%.,[65],['1. Green Fields Agriculture Co. reduced operational expenses by 15% through cost-cutting measures in April 2018.'],"['April saw a 10% reduction in operational expenses due to cost-cutting measures, contributing to profitability.']",By what percentage did Green Fields Agriculture Co. reduce operational expenses through cost-cutting measures in April 2018?,402174,2174,Factual Question
Finance,Cutting-edge CRM system.,[65],['1. Green Fields Agriculture Co. implemented an Enterprise Resource Planning (ERP) system in October 2018 to streamline operations.'],"[""October's implementation of a cutting-edge CRM system streamlined operations further.""]",What system did Green Fields Agriculture Co. implement in October 2018 to streamline operations?,402175,2175,Factual Question
Finance,$60 million.,[65],['1. Green Fields Agriculture Co. invested $50 million in Project Green Harvest in March 2018.'],"['Growth was pursued aggressively; $60 million was invested in Project Green Harvest in March 2018, broadening business horizons.']",How much did Green Fields Agriculture Co. invest in Project Green Harvest in March 2018?,402176,2176,Factual Question
Finance,$30 million.,[65],['1. The total value of the asset acquisition of Fresh Field Farms completed in May 2018 was $25 million.'],['The $30 million acquisition of Fresh Field Farms in May expanded competitive reach.'],What was the total value of the asset acquisition of Fresh Field Farms completed in May 2018?,402178,2178,Factual Question
Finance,Flood.,[65],['1. Severe drought in August 2018 significantly reduced crop yields for Green Fields Agriculture Co.'],"['A flood in August 2018 severely affected crop yields, underscoring vulnerability to climate change.']",What natural event in August 2018 significantly reduced crop yields for Green Fields Agriculture Co.?,402179,2179,Factual Question
Finance,50%.,[65],['1. Green Fields Agriculture Co. acquired 40% equity from Fertile Land Farms in September 2018.'],"['By September, acquiring 50% equity of Fertile Land Farms further solidified market presence.']",What percentage of equity did Green Fields Agriculture Co. acquire from Fertile Land Farms in September 2018?,402180,2180,Factual Question
Medical,Sepsis.,[194],"[""1. L. Brown's initial diagnosis is malaria.""]","['These findings, combined with his travel history, led to the initial diagnosis of sepsis.']","According to the hospitalization records of Ashland General Hospital, what is L. Brown's initial diagnosis?",406110,6110,Factual Question
Medical,Severe abdominal pain and nausea.,[194],"[""1. L. Brown's chief complaint is a high fever."", '2. L. Brown experiences chills.', '3. L. Brown has a headache for 3 days.']","['Ashland General Hospital has reported a case of a 32-year-old male data analyst, L. Brown, who was admitted on March 25th with severe abdominal pain and nausea.']","According to the hospitalization records of Ashland General Hospital, what is L. Brown's chief complaint?",406111,6111,Factual Question
Medical,32.,[194],"[""1. L. Brown's age is 32.""]","['Ashland General Hospital has reported a case of a 32-year-old male data analyst, L. Brown, who was admitted on March 25th with severe abdominal pain and nausea.']","According to the hospitalization records of Ashland General Hospital, what is L. Brown's age?",406112,6112,Factual Question
Medical,Data Analyst.,[194],"[""1. L. Brown's occupation is Software Engineer.""]","['Ashland General Hospital has reported a case of a 32-year-old male data analyst, L. Brown, who was admitted on March 25th with severe abdominal pain and nausea.']","According to the hospitalization records of Ashland General Hospital, what is L. Brown's occupation?",406113,6113,Factual Question
Medical,Severe fatigue affecting daily life.,[198],"[""1. K. Mendoza's chief complaint is tremors in hands."", '2. K. Mendoza has experienced slow movement for 6 months.']","['K. Mendoza, a 33-year-old software engineer residing in Southport, was admitted to Southport General Hospital on June 20th with a primary complaint of severe fatigue that had been affecting his daily life for the past six months.']","According to the hospitalization records of Southport General Hospital, what is K. Mendoza's chief complaint?",406140,6140,Factual Question
Medical,33.,[198],"[""1. K. Mendoza's age is 35.""]","['K. Mendoza, a 33-year-old software engineer residing in Southport, was admitted to Southport General Hospital on June 20th with a primary complaint of severe fatigue that had been affecting his daily life for the past six months.']","According to the hospitalization records of Southport General Hospital, what is K. Mendoza's age?",406141,6141,Factual Question
Medical,Hispanic.,[198],"[""1. K. Mendoza's ethnicity is Latino.""]","['Despite the fatigue, Mendoza, who is of Hispanic descent and married with two children, had no prior significant health issues.']","According to the hospitalization records of Southport General Hospital, what is K. Mendoza's ethnicity?",406142,6142,Factual Question
Medical,Married.,[198],"[""1. K. Mendoza's marital status is single.""]","['Despite the fatigue, Mendoza, who is of Hispanic descent and married with two children, had no prior significant health issues.']","According to the hospitalization records of Southport General Hospital, what is K. Mendoza's marital status?",406143,6143,Factual Question
Medical,Japanese encephalitis,[199],"[""1. H. Flores's initial diagnosis is Epidemic Cerebrospinal Meningitis.""]","['Auxiliary examinations, including a CSF analysis, revealed elevated white blood cells, high protein levels, and low glucose, which further substantiated the diagnosis of Japanese encephalitis, ruling out other conditions such as Japanese encephalitis and common cold.']","According to the hospitalization records of Wilton General Hospital, what is H. Flores's initial diagnosis?",406148,6148,Factual Question
Medical,"Chest pain, shortness of breath, and dizziness persisting for two days",[199],"[""1. H. Flores's chief complaint is a severe headache."", '2. H. Flores has a high fever.', '3. H. Flores experiences neck stiffness.', '4. Symptoms have persisted for 2 days.']","['Resident of Sunnyvale Street in Wilton, Flores was brought in due to a sudden onset of chest pain, shortness of breath, and dizziness persisting for two days.']","According to the hospitalization records of Wilton General Hospital, what is H. Flores's chief complaint?",406149,6149,Factual Question
Medical,85,[199],"[""1. H. Flores's age is 82.""]","['Wilton General Hospital has admitted 85-year-old H. Flores, a retired teacher, who presented with alarming symptoms.']","According to the hospitalization records of Wilton General Hospital, what is H. Flores's age?",406150,6150,Factual Question
Finance,March 2017,[74],['1. Hudson Consumer Goods Co. reported its sustainability and social responsibility initiatives in January 2017.'],"['In March 2017, they launched various sustainability and social responsibility initiatives.']",When did Hudson Consumer Goods Co. report its sustainability and social responsibility initiatives?,403026,3026,Factual Question
Finance,"May 1, 2003",[74],"['1. Hudson Consumer Goods Co. was established on April 1, 2003.']","['Established on May 1, 2003, the company has consistently demonstrated growth and innovation.']",When was Hudson Consumer Goods Co. established?,403032,3032,Factual Question
Finance,$450 million,[74],['1. The operating income of Hudson Consumer Goods Co. in 2017 was $500 million.'],"[""The report detailed operating income for 2017 at an impressive $450 million, showcasing the company's revenue strength from its core and peripheral business activities.""]",What was the operating income of Hudson Consumer Goods Co. in 2017?,403034,3034,Factual Question
Finance,$500 million,[74],['1. The total liabilities of Hudson Consumer Goods Co. at the end of 2017 were $600 million.'],"['Total assets were valued at $1.2 billion, while liabilities stood at $500 million, indicating sound financial health with shareholder equity at $600 million.']",What were the total liabilities of Hudson Consumer Goods Co. at the end of 2017?,403035,3035,Factual Question
Finance,Boston Cosmetics,[74],['1. Hudson Consumer Goods Co. acquired Greenfield Cosmetics in January 2017.'],"['Significant corporate milestones included the strategic acquisition of Boston Cosmetics in January 2017 for $45 million, bolstering their position in the cosmetics market.']",Which company did Hudson Consumer Goods Co. acquire in January 2017?,403036,3036,Factual Question
Medical,"Frequent acid reflux and heartburn, especially noticeable after meals and during nighttime.",[202],"[""1. H. Kim's chief complaint is upper abdominal pain."", '2. The duration of the complaint is 2 weeks.']","['Mr. Kim, who maintains a generally healthy lifestyle and is unmarried, reported a chief complaint of frequent acid reflux and heartburn, especially noticeable after meals and during nighttime.']","According to the hospitalization records of Princeton General Hospital, what is H. Kim's chief complaint?",406174,6174,Factual Question
Medical,Gastritis,[202],"[""1. The patient's preliminary diagnosis is Peptic Ulcer Disease.""]",['Preliminary findings from this procedure pointed towards a diagnosis of Gastritis.'],"According to the hospitalization records of Princeton General Hospital, what is the patient's preliminary diagnosis?",406175,6175,Factual Question
Medical,Unmarried,[202],"[""1. The patient's marital status is married.""]","['Mr. Kim, who maintains a generally healthy lifestyle and is unmarried, reported a chief complaint of frequent acid reflux and heartburn, especially noticeable after meals and during nighttime.']","According to the hospitalization records of Princeton General Hospital, what is the patient's marital status?",406176,6176,Factual Question
Medical,"72, Main street, Princeton",[202],"[""1. The patient's address is 76, Quarryville Street, Princeton.""]","['Princeton General Hospital has recently admitted H. Kim, a 48-year-old software engineer residing at 72, Main street, Princeton, due to health complications that started approximately two weeks ago.']","According to the hospitalization records of Princeton General Hospital, what is the patient's address?",406177,6177,Factual Question
Medical,Cholecystitis.,[204],"[""1. C. Cruz's initial diagnosis is Acute Pyelonephritis.""]","[""The hospital's preliminary diagnosis initially considered cholecystitis, but further examinations ruled it out due to lack of upper abdominal pain.""]","According to the hospitalization records of Indianola General Hospital, what is C. Cruz's initial diagnosis?",406197,6197,Factual Question
Medical,Severe headache and dizziness for 2 days.,[204],"[""1. C. Cruz's chief complaint includes fever."", '2. C. Cruz experiences chills.', '3. C. Cruz has back pain for 2 days.']","[""Upon arrival, Ms. Cruz's primary complaint was a severe headache and dizziness that began abruptly two days prior.""]","According to the hospitalization records of Indianola General Hospital, what is C. Cruz's chief complaint?",406198,6198,Factual Question
Medical,70.,[204],"[""1. C. Cruz's age is 65.""]","['Indianola, IA – On February 17th, Indianola General Hospital admitted 70-year-old male C. Cruz, a retired teacher.']","According to the hospitalization records of Indianola General Hospital, what is C. Cruz's age?",406199,6199,Factual Question
Medical,Male.,[204],"[""1. C. Cruz's gender is female.""]","['Indianola, IA – On February 17th, Indianola General Hospital admitted 70-year-old male C. Cruz, a retired teacher.']","According to the hospitalization records of Indianola General Hospital, what is C. Cruz's gender?",406200,6200,Factual Question
Finance,February 2021,[75],['1. The Code of Conduct was revised by Culture Innovators Ltd. in March 2021.'],"['In February 2021, the company revised its Code of Conduct, providing clearer guidelines and enhancing its ethical framework.']",When was the Code of Conduct revised by Culture Innovators Ltd.?,403129,3129,Factual Question
Finance,Daniel Ricciardo,[75],['1. John Davis was appointed as the new CEO of Culture Innovators Ltd. in September 2021.'],['the appointment of Daniel Ricciardo as the new CEO in September 2021 marked a new chapter in leadership'],Who was appointed as the new CEO of Culture Innovators Ltd. in September 2021?,403130,3130,Factual Question
Finance,Sara White,[75],['1. Jane Smith joined the Board of Directors in October 2021.'],"['October 2021 saw Sara White, a noted expert in cultural innovation, joining the Board of Directors.']",Who joined the Board of Directors in October 2021?,403131,3131,Factual Question
Finance,98%,[75],['1. The compliance rate for information disclosure was 96.5%.'],"['the company reported a 98% compliance rate for information disclosure, demonstrating its commitment to transparency.']",What was the compliance rate for information disclosure?,403132,3132,Factual Question
Finance,"March 1, 2008",[75],"['1. Culture Innovators Ltd. was established on March 1, 2010.']","['Culture Innovators Ltd., a prominent company in the culture industry, was established on March 1, 2008, in New York, United States.']",When was Culture Innovators Ltd. established?,403141,3141,Factual Question
Finance,$60 million,[75],['1. The acquisition of ArtEx was valued at $50 million.'],"['In January 2021, Culture Innovators Ltd. acquired ArtEx, a museum exhibition design firm, for $60 million']",How much was the acquisition of ArtEx valued at?,403142,3142,Factual Question
Finance,November 2021,[75],['1. Culture Innovators Ltd. launched its online education platform in September 2021.'],"['In November 2021, Culture Innovators Ltd. launched an online education platform offering interactive educational programs.']",When did Culture Innovators Ltd. launch its online education platform?,403143,3143,Factual Question
Finance,$12 million,[75],['1. Culture Innovators Ltd. invested $10 million in Project ArtTech in April 2021.'],['investing $12 million in Project ArtTech in April 2021'],How much did Culture Innovators Ltd. invest in Project ArtTech in April 2021?,403144,3144,Factual Question
Finance,20%,[75],['1. The return on equity of Culture Innovators Ltd. was 17%.'],['The return on equity of Culture Innovators Ltd. was 20%.'],What was the return on equity of Culture Innovators Ltd.?,403145,3145,Factual Question
Finance,Data Protection Policy,[78],"['1. InnovateTech, Inc. enhanced the Whistleblower Policy in June 2019.', '2. The policy provides a safe mechanism for reporting suspected fraudulent activities.']","['A key initiative was the enhancement of their Data Protection Policy in June, aimed at providing a safe mechanism for reporting suspected fraudulent activities']","What policy did InnovateTech, Inc. enhance in June 2019 to provide a safe mechanism for reporting suspected fraudulent activities?",402817,2817,Factual Question
Finance,Major investment in Project Ampere,[78],"['1. InnovateTech, Inc. completed an Initial Public Offering (IPO) in November 2019.']","[""November 2019 was noteworthy for the company's major investment of $20 million in Project Ampere, a cutting-edge social media analytics platform.""]","What significant corporate event did InnovateTech, Inc. complete in November 2019?",402818,2818,Factual Question
Finance,NYSE,[78],"['1. InnovateTech, Inc. is publicly listed on NASDAQ.']","['The company specializes in developing software solutions for social networking platforms, and its growth trajectory has been remarkable since going public on the NYSE stock exchange.']","On which stock exchange is InnovateTech, Inc. publicly listed?",402831,2831,Factual Question
Finance,$30 million,[78],"['1. InnovateTech, Inc. raised $50 million in February 2019.']","['In the same month, InnovateTech raised $30 million through large-scale financing, fortifying its financial base for future expansion.']","How much financing did InnovateTech, Inc. raise in February 2019?",402832,2832,Factual Question
Finance,Play4Fun Studios,[78],"['1. InnovateTech, Inc. acquired DreamLife Studios.', '2. The acquisition amount was $60 million.', '3. The acquisition took place in December 2019.']","['By the end of the year, InnovateTech acquired Play4Fun Studios, a well-known mobile gaming company, for $60 million, marking a significant expansion into the gaming industry.']","Which company did InnovateTech, Inc. acquire for $60 million in December 2019?",402833,2833,Factual Question
Finance,February 2020.,[79],['1. Elevate Retail Inc. launched the Sustainability Task Force in January 2020.'],"['Demonstrating commitment to sustainability, Elevate Retail launched a Sustainability Task Force in February 2020, enhancing public image and competitiveness.']",When did Elevate Retail Inc. launch the Sustainability Task Force?,402710,2710,Factual Question
Finance,June 2020.,[79],['1. Elevate Retail Inc. invested in renewable energy projects in May 2020.'],"['In June, Elevate Retail invested in renewable energy projects, mitigating environmental impacts and aligning with sustainable energy solutions.']",When did Elevate Retail Inc. invest in renewable energy projects?,402711,2711,Factual Question
Finance,Fashion Luxury Group.,[79],['1. Elevate Retail Inc. acquired 80% equity of High Fashion Corp. in July 2020.'],"['In July 2020, Elevate Retail acquired 80% equity of Fashion Luxury Group, expanding market share in the luxury segment.']",Which company did Elevate Retail Inc. acquire 80% equity of in July 2020?,402727,2727,Factual Question
Finance,$10 million.,[79],['1. Elevate Retail Inc. reduced its liabilities by $15 million during the debt restructuring in August 2020.'],"['Debt restructuring in August decreased liabilities by $10 million, improving financial conditions.']",How much did Elevate Retail Inc. reduce its liabilities by during the debt restructuring in August 2020?,402728,2728,Factual Question
Finance,40.00%.,[79],['1. The debt ratio of Elevate Retail Inc. was 39.58%.'],['The debt ratio of Elevate Retail Inc. was 40.00%.'],What was the debt ratio of Elevate Retail Inc.?,402729,2729,Factual Question
Finance,5.6%.,[79],['1. The return on equity of Elevate Retail Inc. was 5.52%.'],['The return on equity of Elevate Retail Inc. was 5.6%.'],What was the return on equity of Elevate Retail Inc.?,402730,2730,Factual Question
Medical,Hypothyroidism.,[207],"[""1. E. Chavez's initial diagnosis is hyperthyroidism.""]","['A consultation with a general practitioner a month prior to hospitalization resulted in a diagnosis of hypothyroidism, confirmed by elevated T3 and T4 levels, and suppressed TSH levels.']","According to the hospitalization records of Kingsport Medical Center, what is E. Chavez's initial diagnosis?",406213,6213,Factual Question
Medical,"Palpitations, irritability, and weight gain for the past two months.",[207],"[""1. E. Chavez's chief complaint includes palpitations."", '2. E. Chavez experiences irritability.', '3. E. Chavez has been experiencing weight loss for the past two months.']","['Chavez, who works as a nurse and resides in Kingsport, presented with complaints of palpitations, irritability, and notable weight gain over the past two months.']","According to the hospitalization records of Kingsport Medical Center, what is E. Chavez's chief complaint?",406214,6214,Factual Question
Medical,35.,[207],"[""1. E. Chavez's age is 30.""]","['E. Chavez, a 35-year-old woman, was admitted to Kingsport Medical Center on October 1st with significant symptoms that were impacting her daily life.']","According to the hospitalization records of Kingsport Medical Center, what is E. Chavez's age?",406215,6215,Factual Question
Medical,Nurse.,[207],"[""1. E. Chavez's occupation is a teacher.""]","['Chavez, who works as a nurse and resides in Kingsport, presented with complaints of palpitations, irritability, and notable weight gain over the past two months.']","According to the hospitalization records of Kingsport Medical Center, what is E. Chavez's occupation?",406216,6216,Factual Question
Medical,Osteosarcoma.,[213],"[""1. K. Ramos's initial diagnosis is Acute Osteomyelitis.""]","['Preliminary diagnoses indicate osteosarcoma, as the X-ray showed a periosteal reaction, a potential sign of this condition.']","According to the hospitalization records of Windsor General Hospital, what is K. Ramos's initial diagnosis?",406257,6257,Factual Question
Medical,Persistent cough and chest pain.,[213],"[""1. K. Ramos's chief complaint is severe bone pain."", '2. K. Ramos has difficulty in walking for 3 days.']","['K. Ramos, an 83-year-old part-time librarian and resident of Windsor, Ontario, was admitted to Windsor General Hospital following a referral due to a persistent cough and chest pain.']","According to the hospitalization records of Windsor General Hospital, what is K. Ramos's chief complaint?",406258,6258,Factual Question
Medical,83.,[213],"[""1. K. Ramos's age is 82.""]","['K. Ramos, an 83-year-old part-time librarian and resident of Windsor, Ontario, was admitted to Windsor General Hospital following a referral due to a persistent cough and chest pain.']","According to the hospitalization records of Windsor General Hospital, what is K. Ramos's age?",406259,6259,Factual Question
Medical,Part-time librarian.,[213],"[""1. K. Ramos's occupation is retired.""]","['K. Ramos, an 83-year-old part-time librarian and resident of Windsor, Ontario, was admitted to Windsor General Hospital following a referral due to a persistent cough and chest pain.']","According to the hospitalization records of Windsor General Hospital, what is K. Ramos's occupation?",406260,6260,Factual Question
Medical,Standard neonatal vaccines within 24 hours of birth,[214],['1. No immunizations were given to M. Young immediately after birth.'],"['Regarding immunization, the records show that standard neonatal vaccines were administered within 24 hours of birth.']","According to the hospitalization records of Richmond General Hospital, what is M. Young's immunization history?",406284,6284,Factual Question
Medical,Boston.,[214],"[""1. M. Young's birthplace is Richmond.""]","[""The Boston-born infant's condition is being managed with a treatment plan including oxygen therapy, intravenous fluids, and antibiotics.""]","According to the hospitalization records of Richmond General Hospital, what is M. Young's birthplace?",406285,6285,Factual Question
Medical,35.8°C,[214],"[""1. M. Young's temperature is 36.2°C.""]","[""The newborn's general condition, according to the hospital records, was of a stable temperature at 35.8°C.""]","According to the hospitalization records of Richmond General Hospital, what is M. Young's temperature?",406286,6286,Factual Question
Law,Crime of Embezzlement.,[110],['1. J. Thompson committed the crime of embezzlement.'],"['The court, guided by Article 384, charged Thompson with the Crime of Money Laundering.']","According to the court judgment of Quarryville, Yorktown, Court, what was the crime committed by J. Thompson?",404381,4381,Factual Question
Law,"12th, October, 2023.",[110],"['1. The judgment date was October 10, 2023.']","['This judgment, finalized on October 12, 2023, follows an exhaustive investigation led by the Quarryville, Yorktown, Procuratorate.']","According to the court judgment of Quarryville, Yorktown, Court, what was the judgment date?",404382,4382,Factual Question
Law,L. Thompson.,[116],['1. The chief judge was Y. Carter.'],"['The presiding officials included Chief Judge L. Thompson, alongside Judge K. Watson, and the court clerk, W. Hall.']","According to the court judgment of Cedarwood, Brighton, Court, who was the chief judge?",404436,4436,Factual Question
Law,Nelson & Partner Law Firm.,[116],['1. The defense lawyer K. Nelson belongs to Nelson & Associates Law Firm.'],"['Represented by defense lawyer K. Nelson from Nelson & Associates Law Firm, she faced serious allegations following a series of thefts.']","According to the court judgment of Cedarwood, Brighton, Court, which law firm did the defense lawyer K. Nelson belong to?",404437,4437,Factual Question
